真他妈的坑爹，要了拌面，上来的面连盘子的底都盖不住，加的面就更少了，还新疆拌面呢，要是在新疆这样开饭店，早都被砸了N次了。,差
没去之前看到人气这么高，满怀期待，去了之后感觉太一般了，尤其那个羊肉串，超级难吃！12个人消费1041，85折之后，当时没仔细算，回家后发现多收了35元钱。菜的味道一般，我觉得可能是有托或者店家买通了几个点评平台，把这个店炒火的，感觉真心一般。以后再不会去了！,差
吵阿吵不爱吃羊肉有味道阿只有酸奶比较好喝新疆菜真心不是我的菜自己不会去吃的完全不对胃口雅,差
大盘鸡口味一般，老公说自己在家里也可以做。凉皮还算可以。,差
打了电话说八点半以后才不用排队，那就八点半再去也不妨。冲着大众点评的四星半去的，感觉比较失望。羊肉串不是很香味扑鼻的感觉，就像前面说的，干干的，味道真一般。奶茶很明显的奶精泡的，和真正的根本没法比，羊排应该说是肉质不错，可惜应该是烤好之后微波加热的，不脆，然后还是有些干，难不成是去得晚所以厨房下班啦？总体是失望的，还好没有浪费时间去排队，真不值得。,差
去过新疆很多次，非常喜欢新疆菜。但是号称上海最畅销的耶里夏丽让我非常失望。奶茶敢打赌是用奶茶粉冲出来的，不是用砖茶泡出来的。酸奶虽然浓郁，味道不错，但是估计加了促凝剂之类的添加剂吧。面拉得简直不堪入目，还没有满大街都有的兰州拉面店拉的地道，嚼上去就像是面粉一样。羊肉串干的很，上桌的时候没有热气腾腾香气扑鼻的感觉。好在烤羊排的味道蛮好的，总算有点新疆菜的味道。,差
上次和朋友一起去吃的晚上没事不知道去哪里吃饭就去一直听说他家的菜很好吃但是去却一般般哦服务很好很到位面太难吃了太硬了朋友吃的还没有熟太失望了哎,差
离家很近，每次经过都排队火爆。个么按耐不住了，带着爸妈去吃了次。。结果真是大失所望，大盘鸡。。这么小一盆能叫大盘鸡~~真是晕倒~味道也一般。最坑爹是馕坑烤羊排。。真的坑爹啊~羊排的膻味重的要死，烤的还很生，皮一点都不脆，超软。吃到后来吐都来不及，膻味真是hold不住~。手抓饭也是一股怪味道。。还有咸奶茶的味道也很奇怪，反正我接受不了。。,差
刚开业的时候很好，东西好吃量也足，现在再去，明显不行了，东西难吃了，分量变少了，服务员也不听话了，哎，不知道说啥，只能下次不去了，最可恶的是，埋单会四舍五入，如果5.5元就会莫名的收6元，虽然钱不多，但明显不合理！！！,差
耶里夏丽餐厅。奶制品还勉强可以成为美食。。但羊肉膻味实在好大。说是。正宗的新疆餐厅，太言过其实了。还不如在福建持的小尾羊了。且也拔丝香蕉也没有了。如果不是吃拉面，下次应该不会再去了。,差
他家的菜吃了2次,差
本来想去吃烤肉，路过这家店的时候，看到外面很多排队的人，跟风的心里吧。,差
特喜欢新疆菜耶里夏利几乎每家店都吃过这家店服务态度最差叫服务员总是说稍等然后根本不忙在那边点菜的迎宾的居然发出不屑的口气很不爽只有一个收拾台子的大妈最好了菜嘛都吃好了还有菜没上说没烧就不要了就说在烧了反正这顿饭吃的超不爽,差
说实话搞不懂这家店为什么那么高人气,差
服务实在是太差，半天找不到一个服务员，买单的时候服务员理都不理，最后自助买单。隔壁那桌客人来了没人收拾桌子，叫半天没人理，最后客人自己动手收拾的碗筷，濉烤羊排很一般，丁丁炒面好吃，很有韧性，跟嚼qq糖一样。,差
相比这个牌子的天山店，这家就明显不让人舒服了，位置极其拥挤，装潢搞的像维族大食堂一样，一个仄逼的角落里，居然放了3张桌子，搞的坐里面的人想上个厕所都出不来。吃的东西也还算保持一定的水准吧，不过服务员久催不来，很大牌嘛。。然后周一去的，帮我们说今天没表演，妈的没表演怎么不说清楚，还说每天晚上6点有歌舞，这家店是再也不会去了,差
东西部这么样！！不过因为我是新疆长大的所以要求搞了点，不好意思！！有时候真的觉得到那些破破烂烂的当地人开的店里反而可以吃到最正宗的味道,差
昨晚去吃了，生意爆好。。。但是，味道不咋地，份量不咋地，服务态度更不咋地。。。不会再去第二次了。。。真是费解，就这服务态度，就这味道，竟能如此火爆。。。@_@,差
点个单见叫老半天也不见来2个人点了羊肉串一般大盘鸡上来就不热的怀疑是大锅菜酸奶和外面的差不多真心的一般,差
