味道好吃服务员周萌萌服务也很到位，节目也很好看！非常满意！,非常好
新菜不错，羊肉串一如既往的好吃！,非常好
南玲服务很好口味不错速度挺快！,非常好
菜的口味很好。演出很棒。服务员杜青青必须点赞。多次光顾了,非常好
人好多呀！店面有些老了，服务员周华铮不错,非常好
菜品不错，人太多，服务不错，王丽娜,非常好
盖爽服务超好，菜也不错，表演超赞,非常好
非常好吃，表演精彩，给服务员盖爽点赞,非常好
味道不错。服务一如既往不错。服务人员：周萌萌,非常好
很久不吃新疆菜，还是有点想念的。耶里夏丽排队太厉害了，每次总觉得要放弃。终于有机会在八点半以后直接入场，妥妥的。,非常好
非常值得推荐羊排非常完美非常值得推荐羊排非常完美,非常好
一直来，服务员龚晨晨服务态度也很好,非常好
一直光顾这家店，非常好，服务环境都很好,非常好
味道很好，服务员龚晨晨也很周到，下次再来,非常好
口味一如既往地好午间套餐很方便服务员郭小艳很热情,非常好
午市套餐挺合算的，服务员南玲很热情,非常好
王丽娜服务员服务热情。常来的店。今天的羊肉串特别好吃。,非常好
一个字，棒，很不错的菜肴，一次再来,非常好
服务员王丽娜非常热情，态度很赞。菜的味道很好，还有即兴歌舞。强烈推荐！,非常好
很不错的地方，值得大家去，王丽娜。,非常好
菜品很合口味，很地道！袁俊峰服务五星好评！,非常好
大盘鸡，羊肉串都很好吃周华筝服务的很好....,非常好
葡萄好吃！特色！周华正服务的很好！！！！,非常好
等位中周华筝服务的很好....,非常好
好吃，袁俊峰服务周到！！！！！,非常好
味道很好羊肉很嫩很好吃，服务员王丽娜很热情，服务很周到,非常好
口味不错，王春梅服务态度很好～,非常好
菜量好多，吃不完打包，明天午饭继续。服务员龚晨晨好评。。。,非常好
味道不错，袁俊峰服务好，葡萄很好吃。。。,非常好
味道不错服务员郭小艳服务态度好,非常好
非常好吃，服务员王丽娜服务态度好,非常好
王建立小姑娘服务态度很好赞一个,非常好
菜品特色周华筝服务的很好....,非常好
服务员张露露服务态度很好，菜很好吃！,非常好
外卖方便周华筝服务的很好....葡萄好吃,非常好
张露露，非常好感谢服务，非常好，太感谢服务员服务，下次一定再来。,非常好
非常好，张露露服务非常好值得一来,非常好
好吃，舞蹈表演很好，郭小艳服务挺好的,非常好
？，很好吃王建立服务态度很好。,非常好
经常过来很好吃服务不错龚晨晨态度很好,非常好
魏霞服务态度周到热情，值得点赞，更应得到嘉奖！,非常好
羊排非常好吃哇哇哇。。。周萌萌,非常好
羊肉串好吃周华正服务的很好～=,非常好
王建立服务态度好好，赞一个赞！,非常好
周萌萌服务很周到，菜品特别好，推荐,非常好
口味不错！还有表演看。很精彩！！！！！！！！,非常好
念念不忘咸奶茶和烤羊排，服务人员盖爽人很好。新疆歌舞节目很好看,非常好
周萌萌服务态度确实不错。下次来还找她,非常好
好吃经常了周华筝服务的很好....,非常好
光顾好几次了，每次都很好吃，喜欢牛羊肉的比较适合这里。,非常好
买单方便周华证服务的很好！！！,非常好
王建丽服务态度很好，！！！！！！,非常好
耶里夏丽的菜还是一如既往的好，马玉龙服务员的服务也非常好哦。下次还会来光顾。,非常好
周萌萌菜量很多味道不错！下次还会来,非常好
王丽娜，王牌一直都很好吃，海鲜番茄也不错。,非常好
盖爽服务很好，点的套餐都很美味,非常好
带着妈妈和外婆来吃饭，3个人好饱还打包，美女服务员盖爽热情细心又周到，很满意的一次拔草：）,非常好
不错不错，喜欢新疆菜，而且不贵，有表演看。,非常好
马亚丽服务很不错！菜很好吃！大盘鸡很好，抓饭分量很小……,非常好
郭小燕服务不错，赞一个！！！！,非常好
好吃有特色～～～～～～～～～～～周萌萌,非常好
经常来吃饭，民族风的表演也很有特色。服务员张露露亲切友好。,非常好
周萌萌服务好菜品特色民族风情特别好,非常好
环境蛮好，大盘鸡的味道可以！羊肉串的味道纯正！马亚丽服务好！,非常好
外卖方便。周华筝服务的很好....,非常好
表扬下周萌萌，服务很周到，菜也很不错,非常好
最爱的家乡菜，一个拌面就能让我有深深的满足感！,非常好
喜欢的口味，尤其是咸味奶茶，每次必点。服务员周萌萌很热情，非常到位。,非常好
周萌萌服务态度很好，喜欢这里滴口味，奶茶不错，下次还会光顾,非常好
不错，一直来。王建丽很好，服务也很好哦,非常好
口味环境一级棒马玉龙服务好！葡萄好吃,非常好
周萌萌，环境口味俱佳。下次再来。,非常好
周萌萌，萌萌哒，棒棒哒，烤肉很好吃,非常好
烤串，酸奶，烤馕，大盘鸡都不错！,非常好
味道不错马亚丽服务不错谢谢谢谢,非常好
虽然我是被要求提魏霞这个服务员。。但是基于她勇于制止邻桌吸烟。那我还是表扬一下吧????,非常好
张露露美丽大方，服务热情，菜品味美色靓，下次再来！,非常好
服务员态度和蔼张露露好吃菜给力,非常好
味道很不错，叫张露露的服务员服务也到位，以后有机会还会来的。,非常好
服务很好，马亚丽热情好客！??????,非常好
给马玉龙点赞，服务态度很好很热情,非常好
羊肉串好吃周华筝服务的很好....,非常好
杜青青，服务态度挺好，羊肉串很赞，酸奶很好喝,非常好
公司附近的店，每次去都很多人，晚了还要排队等位，有时候会碰上表演，很爱吃他家的羊肉串和风味炒馕～,非常好
魏霞服务态度很好，菜量少了点，,非常好
周萌萌服务态度非常好，餐厅环境不错,非常好
很满意，服务员马亚丽服务也非常棒,非常好
魏霞服务态度很好，下次还来，，,非常好
服务员魏霞非常好，帮我们催面。,非常好
菜肴色香味俱佳环境非常好一边饱口福一边欣赏音乐舞蹈还上台互动服务态度好,非常好
就喜欢这里的羊肉串和那个点心，现在卖的葡萄也好吃，服务员杜青青服务也很热情，满意的一次就餐,非常好
好，魏霞服务周到，下次再来。。。。。,非常好
马亚丽服务非常热情周到，味道也非常好,非常好
很不错，服务员叫盖爽，给她也点个赞,非常好
味道很不错！张露露服务员很可爱可亲！,非常好
菜的味道非常好，服务非常周到，特别是景银银,非常好
菜品很好吃，尤其是烤串，常来！服务员魏霞也不错,非常好
菜式很好，表演精彩，特别感谢服务员马玉龙的周到服务,非常好
周萌萌，服务非常好东西也很好吃,非常好
王建立小姑娘，服务态度很好。菜的味道也不错,非常好
夏令时节进补！环境不错，味道很好??,非常好
味道好，服务员马玉龙服务周到。,非常好
环境好，价格实惠，菜品口味真心不错，还有新疆舞蹈表演，服务员周萌萌服务特别到位，值得推荐！,非常好
服务态度不错，景银银，东西挺好吃的，也有优惠,非常好
感觉不错，尤其是小羊排。服务员热情周到，名字叫马亚丽,非常好
味道不错，东西很好吃。我们经常过来哦,非常好
味道很好，周萌萌服务很好！下次再来,非常好
周萌萌菜品口味特别棒环境特别好,非常好
周萌萌这个妹子服务很周到，给个赞！,非常好
周萌萌服务好，菜口味佳，用餐环境好,非常好
环境不错，味道可以，服务员周萌萌,非常好
服务员周萌萌服务很周到，店里的事物也很不错，新疆特色浓厚，口味正宗，下次还会来哈,非常好
魏霞服务真好。下次再来。开心?,非常好
菜蛮好吃的，周萌萌妹子服务特好，人也美??,非常好
周萌萌服务不错，给个赞！！！！,非常好
老顾客了，一直来这家店吃，周萌萌服务不错！,非常好
张露露服务非常好，用餐环境也很好，不错,非常好
周末同事出来teambuilding，早上运动完正好出来可以中饭。耶里夏丽东方路的人气还是旺，人很多，服务员也很多。这桌服务员周萌萌态度很不错，全程微笑服务呀！菜品都不错，这次都是肉，完全扶墙进扶墙出！,非常好
今天团队活动来这里，味道一级棒，服务也超强，周萌萌加油,非常好
棒棒哒！盖爽赞！分量很多，没吃了…不过还是挺正宗的~,非常好
环境有特色服务也很好杨丽！！！,非常好
菜做的很不错，特别是羊排特好吃！服务员杨丽态度很好！,非常好
菜品有特色，杨排很嫩，值得下次再来。服务员景银银态度好，印象深刻,非常好
经常来这拔草，晚上七八点来的时候人总是很多，再晚一点来很多菜又没有了，基本都是遇到态度服务都很好的女服务员，辣的酸的甜的菜口味都很明显，来这里的老外也很多，欧美的，中东的，印度的，各个区域的都有，当然我们天朝人也很多，推荐来尝试。,非常好
挺好的选择、就是去晚了没赶上她们表演、味道很好、环境也不错、地方又大、不回让人感觉到压抑、里面小姑娘服务态度很好、羊肉串也特新鲜考的非常到位的、羊排味道很鲜美、第一次到这里吃，感觉蛮好的、还有大盘鸡，????那黑啤喝的有点晕,非常好
魏霞服务很好，菜品一如既往的好??,非常好
杜青青非常好，服务到位，下次还来,非常好
"张露露服务好,菜品味道不错,赞",非常好
魏霞服务很好，菜也赞，下次还来,非常好
经常来吃，马亚丽服务很好，非常好吃菜,非常好
魏霞小妹服务态度很好，烤羊腿好吃,非常好
张露露服务非常好环境非常好口味好,非常好
菜好，服务更好，张露露服务很好！,非常好
很好吃，王丽娜很热情，服务周到！,非常好
经常来…周华征服务的很好………,非常好
好多次来周华正服务的很好//+//,非常好
马亚丽，服务好，口味也不错哦。,非常好
马乌龙服务挺好的，牛奶饭好吃的，凉皮好吃的,非常好
味道很不错，马亚丽的服务特别好。,非常好
马亚丽服务很棒，人也长得漂亮,非常好
王建立服务态度很好。赞一个yan,非常好
马亚丽，菜品一如既往的好吃，服务也很到位,非常好
老客户了，有了几个新菜式，还不错,非常好
菜品号好服务好好王丽娜服务好好好,非常好
王丽娜服务很棒！羊肉串味道也很正宗！,非常好
王建立小美女服务态度很好赞一个,非常好
口味不错，还有表演，服务也不错，收银员王丽娜耐心可爱，必须“赞”一个,非常好
羊肉串和羊排味道都很棒，而且很便宜，比小肥羊的不知道强都少倍哦。,非常好
家人聚餐，好吃，马玉龙服务不错，赞一个～,非常好
王建立服务态度不错。葡萄好吃。,非常好
整体都还不错服务员王建丽和热情,非常好
对服务员满意马玉龙不错，不错，不错,非常好
挺好哒，王健丽服务很好哟66666666,非常好
王建立小姑娘服务态度很好赞一个下次找她服务,非常好
有点油啊擦擦擦擦擦擦擦擦，周萌萌,非常好
周萌萌负责我们桌，一直很喜欢这家店，尤其是父母觉得性价比很高，味道好，也不算贵。,非常好
王建立赋予态度不错。赞一个??,非常好
魏霞小妹服务态度很好，烤羊排好吃，下次还来,非常好
王建立服务态度不错，菜味道也好。,非常好
周萌萌非常好，人好服务好长得好，很舒服,非常好
味道不错，服务员周萌萌态度很好，赞一个,非常好
菜的味道还是很不错滴，啤酒??有点贵,非常好
周萌萌服务太好了，孩子们也吃的开心下次还来,非常好
杨丽服务员很周到热情，菜品不错，,非常好
?比?百???联???世??贸??楼??上??那??家??好??吃??太???多???太?多?完??美???,非常好
周萌萌，羊肉很赞，希望保持，????,非常好
和逗逼夫妻偶遇一下就就近选择吃个饭…下雨天6点左右到还不用排队，突然感觉有点小小的幸运~点了招牌??大盘鸡，烤羊腿，羊肉串！相比其他的新疆餐厅这家算是很地道的啦~牛奶饭和娜帕里勇超级好吃~不过吃多了有点小泥,非常好
味道很喜欢，服务也还行，中场会有表演我很喜欢,非常好
服务很好，口味很好吃！！！,非常好
王丽娜服务很好！！！！！！，，,非常好
服务员张露露服务员很好吃??很好开心下次再来,非常好
王建丽服务态度很好！！！！！！,非常好
喜欢的餐厅，经常搞活动。炒烤馍、面筋、点心、大盘鸡必点,非常好
口味很好，杨丽服务很好，笑容美丽,非常好
杜青青服务很好啊，蛇舞很精彩！,非常好
挺好吃的，张露露服务态度好，很nice,非常好
杨丽服务不错，口味不错不错字数不够,非常好
量足，味鲜，杨丽同学服务好^_^,非常好
工作午餐的首选中午有套餐很划算味道正宗,非常好
中午生意不错，排了一会就吃到了，味道不错，服务员杜青青态度很好，期待下次,非常好
王建立服务态度很好。赞一个。！nnb,非常好
大盘鸡量很多@@@@@@@@@@@@@@王丽娜,非常好
张露露很好，热情服务，周到。下次还来,非常好
周华铮。。。。。。。。服务的很好....,非常好
多次来吃东西了，上菜很快～口味不错的哦,非常好
味道还不错排队人也不少下次还回去因为如果很多家了都没让我失望~,非常好
口味一级棒，服务员马亚丽服务不错。,非常好
味道挺好的，服务员杨丽态度不错,非常好
杜青青服务不错～食物味道很好，来过很多次啦,非常好
杜青青服务态度很好值得表扬，希望能够得到单位奖励。,非常好
有一段时间没来吃了，今天带朋友过来吃了新疆拉面，服务人员～盖爽（人如其名），给了我们非常好的服务，热情周到，落落大方，建议用餐等都很到位，是一位河南籍的女孩??，一定要点个赞！,非常好
薄饼羊肉卷还是那么好吃，烤全翅是奥尔良口味，还不错哦，服务员盖爽服务态度挺不错的,非常好
一直很喜欢吃他家的薄饼羊肉卷，羊肉和洋葱完全就是绝配好么！它和烤羊排都要趁热吃才香。牛奶饭甜甜的，吃多了会有点腻。新疆奶茶也一直是必点项，很醇厚，咸味比甜味的更好喝~就是负责我们桌的服务员稍微冷淡，不如以前去的其他分店热情。我们要的炒饭迟迟不上，前两次催的时候说马上就好，饭都吃完了还没上我们就问能不能退了，服务员支支吾吾没给退，说这个点客流量少了退了怕卖不出去。,非常好
今天看了一场很漂亮的表演，还和蛇??亲密接触了一下，大半年没来这家店了，服务员张露露居然还记得我们，服务还是一如既往的好。这次晚餐吃得十分满意，还多了很多新菜色呢??，羊肉串必须的。凉皮，椒麻鸡??也很好吃。,非常好
环境不错，味道不错，歌舞有特色，值得再来,非常好
盖爽小美女服务超一流，下次来还找她！菜品一如既往的令人满意！,非常好
杜青青服务不错,非常好
好吃服务超级好最爱大盘鸡特别表扬一下我们包间的服务员张露露热情又周到,非常好
服务员张露露带我们去了最大的包厢，服务也很热情，哈哈一不小心点多了。大盘鸡必点噢！,非常好
周萌萌菜品味道不错。服务很好。下次还来,非常好
盖爽服务很好也很亲切就是好啦么么,非常好
王建立服务态度不错........,非常好
心血来潮想吃新疆菜了，到耶里夏丽时已经6:20分了，开始漫长的等位，超过45分钟可以抽奖一次，抽中了奶茶一壶。7:30终于入座了，全家已经饿的可以吞下一头牛了。点了羊排，羊肉串，大盘鸡，新疆拌面和哈密瓜。羊排和羊肉串一如既往的好吃，鲜中带一点点羊骚味（写这句话的时候我的唾液分泌增多）。大盘鸡很入味，带了一点辣，不错！新疆拌面太辣了，本来想点给孩子吃的，后来只能给大人吃了。最惊艳的是哈密瓜，不仅甜而且水分多。全家赞不绝口??，最后买单时还买了一个回家。,非常好
好吃！味道不错！就是表演的时间太少了！老是看不到表演～之前看过他们家表演，觉得不错，所以一直来吃，可是后面就再也没看到过了～哎！！！表演能加几场吗亲？？？,非常好
菜好吃，量够大，性价比很高....,非常好
挺好吃的，环境挺好的，杨丽服务员挺热情的,非常好
虽然是连锁店，但是味道各有不同，这家店的味道蛮不错的，奶茶没有其他店那么腥，现在是吃哈密瓜的季节，非常甜，酥酥的甜甜的，这才是真正的哈密瓜啊。歌舞表演仍然很有特色，也有外国友人来凑热闹。酸奶浓郁。大盘鸡口味略重，比较入味。。,非常好
王建丽服务态度很好，菜的味道的很灵,非常好
味道不错，表演也。。竟然有蛇。。。服务员杨丽赞一下,非常好
王建丽服务不错菜品不错！！！！,非常好
菜的味道不错，新疆舞蹈很精彩.服务员马亚丽服务很好谢谢,非常好
服务员张璐璐是个热情好客的服务员，不错！,非常好
味道不错！！菜品也蛮多的！！！,非常好
环境很不错张露露的服务态度非常好,非常好
这家好像经常吃唉量多吃不完好浪费啊。,非常好
张璐璐服务好脾气可亲都挺好的菜好吃,非常好
王建立了服务态度很好。赞一个??,非常好
服务员张露露很可爱的哦中午人不多的赞,非常好
服务员、马玉龙????服务态度很好帅哥一枚,非常好
杜青青服务员很漂亮，服务也很好哦，很棒,非常好
服务员王丽娜服务态度挺好！！！,非常好
店好，杜青青服务员服务好，价格实惠，表演不错,非常好
工作日晚上去的人特别多生意一直不错的以前也经常去吃羊肉串烤羊腿大盘鸡都是必点的特色菜??口味依旧好吃饭中间还会有歌舞表演灯光会关掉让我们几个吃货有点尴尬hhh酸奶也很好喝厚厚的老酸奶还有napaliyong一种新疆糕点真的超级好吃也不腻赞?,非常好
杜青青长特别得美!!!!!!服务也好!!!!,非常好
无肉不欢一直是首选服务员景银银服务也很到位演出也精彩确是一场美食美景的盛宴,非常好
"菜味道不错,还可看表演.杜青青",非常好
景银银服务非常到位菜品很好一如既往,非常好
王建立服务态度很好赞一个！！！,非常好
环境很好，正好看到了很多表演，杜青青服务也很好,非常好
周萌萌服务很周到。菜品味道还行,非常好
门面不大，但里面空间很大。,非常好
性价比超高，味道不错。很好吃，下次还来。周萌萌服务非常好,非常好
菜非常不错，服务员杨丽热情周到，非常满意,非常好
周萌萌服务很热情。。。：）：）,非常好
服务员盖爽服务态度很好.很开心,非常好
丽娜很友好哦环境也很好工作日也爆满哈,非常好
耶里夏丽的老顾客了，环境好，菜口味好，服务员周萌萌服务到位，会经常光顾的,非常好
周萌萌服务态度非常好，微笑相迎，服务质量好，五星满赞。,非常好
周萌萌很萌啊！烤羊排很好吃啊！,非常好
来上海要吃的新疆饭，挺正宗的，中午饭点人很多，需要等位，上菜还是蛮快的,非常好
羊排，尝了一口，膻膻膻。羊肉串好吃，一点不膻。娜帕里勇，看着有点像芝士蛋糕。新疆奶茶，还行。吃了5串羊肉串就饱了，其他全部打包，感觉自己太不能吃了，浪费。。,非常好
可以边看表演边吃饭，表演时间是晚上7:30，但是有时会延误，但是菜的味道很棒。尤其是招牌菜很好吃。,非常好
第一次来，东西好大份啊。顺便说一下，王建丽服务很不错。,非常好
菜品味道很好，服务很贴心，王建丽微笑服务赞一个。,非常好
王建立小姑娘服务态度很好，菜色不错。,非常好
服务员马玉龙服务很哈。赞一个。,非常好
口味分量都不错，魏霞服务很周到,非常好
周萌萌服务很满意，羊腿很好吃……,非常好
杨丽服务态度好东西挺好吃，。.,非常好
王建立服务态度很好。赞一个??,非常好
服务员盖爽服务很体贴，很亲切，赞,非常好
大盘鸡很好吃，服务员袁俊峰服务很好,非常好
王建丽服务态度好菜品好下次还会来,非常好
服T狄嵴大方又美～食物好吃！再恚??????????,非常好
非常喜欢这里的羊肉，觉着是上海最好吃的羊肉串。,非常好
南玲美女服务热情，菜味道也很棒,非常好
服务员王丽娜服务很好，优惠力度太小,非常好
杨丽服务态度好。东西不错………………,非常好
经常来吃，一如既往，给王丽娜服务员点个赞，服务很好！,非常好
味道不错，杜青青服务员也蛮热情的,非常好
口味不错，午市人也挺多的，服务员盖爽挺热情的,非常好
菜品味道好，量足，服务员王丽娜小姐服务周到,非常好
周萌妹子很漂亮！服务好！加油！,非常好
魏霞……味道很好…………很好……下次还来,非常好
王建立服务态度杠杠的给他赞一个,非常好
张露露服务态度很好很好很好很好,非常好
服务态度好很。王健丽小姑娘不错,非常好
魏霞服务很好舞蹈不错菜量很足！,非常好
盖爽服务员很好，不错，菜品好吃,非常好
_王建立服务态度好好。赞一个赞,非常好
口味不错，叫的外卖，不过看着很干净，味道还行,非常好
王建立小美女服务态度好好。赞一个。下次来找她,非常好
周萌萌服务很好，这个饭店很好！！！！！,非常好
全体家庭成员一致认可的餐厅，食物可口老少皆宜，尤其要称赞服务员王建丽??,非常好
餐厅环境和服务很好。小帅哥吴朋宇服务热情。,非常好
很满意还送了葡萄干服务员盖爽今天我生日送了长寿面,非常好
环境不错，服务龚亚狄小姐很热情！值得来！,非常好
菜品好吃周华征服务的很好.............,非常好
一直看到这家店生意火爆，每天到了饭点都是排队等位的人！店里门口会有新疆的土特产出售，葡萄干呀，核桃呀，哈密瓜呀！由于听说有歌舞表演，所以挑了个靠近舞台的桌子！查了大众点评上的推荐菜后，点了人气较高的凉皮，手抓羊肉，羊排，羊肉炒饭，大盘鸡是必点的！还点了新疆特色的芝士糕点具体叫什么忘记了！七个人吃掉800块不到，人均也就100多点！味道真心不错，下次还会再来,非常好
以前来都要等位，今天下午来人少有位子也比较安静，还有曾璐服务态度很好！赞一个,非常好
羊腿的味道和份量超乎想象，感谢服务员马亚丽，很棒！,非常好
好吃。南玲服务态度很好。大盘鸡很好吃,非常好
南玲服务员非常好，大盘鸡特别好吃要了四份面，很好！,非常好
王建立服务态度很好。下次过来找她,非常好
挺好，周萌萌，下次还可以来品尝,非常好
龚亚狄服务很好菜也很好吃经常来,非常好
新疆餐厅不错。王建立服务员服务很周到,非常好
王建立服务态度很好。??赞一个,非常好
周萌萌菜的口味很棒，服务热情，周到！,非常好
整体不错。服务也很好。平时还会来。,非常好
地方很大～等位很快～上菜也很快，叫龚亚狄的美女服务员服务很周到细心～赞一个??,非常好
龚亚狄，服务很好很好好好好，菜品很好,非常好
好的不错，马亚丽的服务态度很好。,非常好
周萌萌，味道不错，晚上还有表演,非常好
一直来吃的，味道和服务都很好，马玉龙服务态度也很好，继续加油,非常好
菜品很好吃，服务员袁俊峰服务很好,非常好
第一次来感觉很好周华筝服务的很好.mm,非常好
味道不错，上海吃新疆菜首选，羊肉和羊肉串烤的蛮好的，还有自制酸奶,非常好
周华正很好，下次再来，，，。。。。,非常好
王建丽服务很好哦，口味不错，很好.......,非常好
龚亚狄，服务到家，贴心服务，赞,非常好
哈密瓜虾仁很不错~魏霞服务很好，点赞~,非常好
非常棒！盖爽服务很热情！！！！,非常好
马玉龙小哥的服务非常好，以后还会再来,非常好
