一直都是参看别人的点评，今天有雅兴，也来抒发下，新疆菜载歌载舞，大口喝酒大口吃肉！喜欢！就是人多，不过人多提早预定包间还是极好的，羊排，羊腿，羊肉串，椒麻鸡，石河子凉皮，羊皮筏，杏鲍菇推荐！还要一个一统天下哦,非常好
棒棒哒，宽敞6年老会员了，强烈安利,非常好
羊肉串真的很好吃，羊排、羊腿也不错的，酸奶很灵。,非常好
东西很好吃，上菜速度一半，服务员态度很好,非常好
不错晚上去的早只等了一会就有座了。肉串好吃晚上的表演也好看,非常好
服务很好，饭等着赶火车，提前做的,非常好
羊肉串好吃，去过好几家，这家离家近，环境也不错。。就是羊腰有点骚臭味吃不惯,非常好
刘丽很棒，我支持你！加油哦！！,非常好
每个菜味道都很赞，东方路店的厨师团队应该是该品牌在上海最优秀的团队了，继续保持吧,非常好
老板这过油肉拌面难吃了诶……面也少了点吧…………哄上海人呢吗？这面二道桥卖的出去呢吗？饭堂子就好好吃饭嘛…舞跳的再歹也不顶用………,非常好
很好吃！最爱娜帕里勇！必点！一个人能吃掉一份。菜的份量都很足。羊肉串也好吃。上菜速度也挺快，就是等位有点心累，人太多了。会有跳舞表演。还会邀请客人上去一起互动，服务员都挺有礼貌，很赞！可以回了南京南京没有～可惜～,非常好
周六中午到店吃饭的～,非常好
哈这家新疆菜很久了了，平时都大排长龙，好不容易盼到过节错峰人少不用排队，果断杀过来。果然，饭点时间5人位不用等。羊肉串，烤羊排必点。大盘鸡满满一大盘，汁浓味美。拔丝蜜瓜，就算凉了拔不出丝了也好吃，壳脆脆甜甜。那帕里勇和酸奶紫薯也可圈可点。结账性价比还超级高。唯一不足的是上菜太快，服务员每上一个都说这个要趁热吃。来不急啊……,非常好
环境不错，十一点就很多人了，还是那样物美价廉。,非常好
在上海吃到的，带孩子和婆婆来玩，住在附近，看到只有那里评价最好，不负期望，人也不多，环境很好，服务也是一级棒，朋友说怎么去上海吃新疆菜，不过真的很好吃,非常好
生日和先生简单晚饭，俨然已经成为家后门食堂，想吃羊肉新疆菜就直接过来。两个人一份烤羊腿，一碗凉皮两份酸奶，吃的满足平静。多出来吃不完的打包，明晚加素菜来一盆炒羊肉哈哈。,非常好
浦东店是第一次来，以前是在五角场店吃了好几次点评也是第一次写,非常好
n次来了～依旧点咸奶茶～壶变好看了～最爱囊烤羊排～干杯土豆片和大盘鸡都不错～只是好像土豆点多了～吃不下了～哈哈哈哈～耶里夏利的量还是很足的～这次去刚好不用排队～大盘鸡有点辣～宽面很q～服务很好～上菜也蛮快的～,非常好
再次去吃耶里夏丽，有好多新菜！等人是件苦差事！哈哈！等朋友的时候来了一份酸奶！不酸不甜，配上他们的葡萄干真的很好吃。比西贝的酸奶好吃多了！朋友很喜欢他们的羊肉串！我倒是觉得没有家门口的好吃！惊艳我的是娜帕里勇，真心好吃，感觉比甜品店好吃多了。吃完打包了三份回家！其他菜感觉没啥变化！生态小土豆真是失败，一点也不好吃！,非常好
环境好味道好价格还行值得再去。。。。。。。,非常好
比我想象的还要好羊排烤羊腰子都很好码很大中午还有新疆舞看新疆美食非常不错推荐给大家,非常好
在世纪公园赏梅，完了以后过来聚餐，服务很好，点了份烤羊腿，不得不说比外面那些专业做烤羊腿的还好，肉非常嫩，也很香。其他有印象的菜是馕包肉，馕是真的好吃，里面的肉也肥而不腻。原味奶茶也很好喝，其他的都想不起来了，总体来说非常好吃。,非常好
在上海发现这么正的清真馆子，菜品多样颠覆了传统清真馆子只有串，拉面的样式，多了特色甜品，奶茶。最让人记忆深刻的是每晚七点的特色表演，跳的非常不错～民族的现代的都有。烤羊腿非常赞，番茄牛肉好评！好希望北京也有这家店！,非常好
来上海出差，和以前的同事叙旧，地方很好找，就在中油的酒店对面。店的面积不小，很有西域风格，服务员也很热情。由于是头一次来，就按照在帝都新疆馆子的套路来，羊肉串，馕，炝炒包心菜，菌菇小炒，水果莎拉，羊排，还特意点了瓶疆啤。羊肉串味道正宗，每串肉7和油都很嫩滑，羊排打80分，缺点黑胡椒，炝炒包心菜虽然简单，但要做的入味地道，并不简单。这家可以入围。菌菇小抄用锡纸包裹加热，打开后弥漫着菌类特有的香味，配上疆啤感觉倍爽。,非常好
口味：羊排好啊一如既往好吃，大盘鸡还是超级大份那个甜品吃慢变软没有冰爽感了口感差一点。大拌菜中规中矩比较多，凉皮比较好吃呢！味道很赞。,非常好
中午去了，东方路上的耶里夏丽。饭店旁边就有停车场。十元随便停。虽然店里吃饭不能报销车费，但是可以凭停车小票拿一份酸奶，酸奶9元1份。也算是另外一种形式的报销吧。可以接受，说明店家也为来吃饭的顾客考虑到了，值得赞赏！店里的服务员和厨师都是新疆人，地地道道的！晚上还有歌舞真人秀。点了羊肉串，外面街边的我绝对不敢吃，这里我绝对放心吃。他们伊斯兰教的信仰还是有的，绝不会乱来。3.5一串绝对良心价。凉皮酸爽可口。面筋筋道。大盘鸡，绝对的大，鸡块大，土豆也大。我很喜欢吃土豆，精华全在土豆里面。里面的面条也是一绝。真的入味，鸡肉的香味浓郁。面条爽口，滑溜！还要大力夸奖一下娜帕里勇，奶香四溢，口感醇厚。大赞！！！,非常好
耶里夏丽的店去过好几家了，东方路这家是第一次来。这次是和真正懂新疆菜的同事一起过来的。羊肉串，大盘鸡必点，大盘鸡里的土豆好香；另外一个新疆特色是奶茶，是羊奶做到，特别的地方是咸的，而且茶壶很特色；手工酸奶不错，没有那么甜，很香；还有烤羊腿，香而且熟软；有一个素菜叫皮拉红，菜新鲜开胃爽口；还有羊肉土豆里面泡馕??再有就是拔丝哈密瓜，好吃不甜腻；有一个辣椒牛柳，辣椒的辣度不错。五人600多，送券????总结起来就是好吃够味下次还来！??,非常好
味道好菜量大吃过很多次了赞赞赞,非常好
在上海吃到如此正宗新疆菜，心情简直没得说的好呀！这个地方好火的！里面满满的，外面等待的吃客也满满的。遇上周末更是火的不要不要的。菜品特色做法和原料都是值得反复回味的。好吃！还要来光顾。提醒大家：一定要提前预定呀！,非常好
菜品丰富，味道很正宗，服务很好，羊肉串很好吃,非常好
位置服务，价格，什么都好，饭菜不错，吃货好久才评论,非常好
很久没吃耶里夏利了，和朋友们相约一起晚饭，点的几道菜都不错。羊肉串肥瘦适宜，肉香又嫩，好吃又不贵。石河子凉皮，酸爽可口很解油腻，凉皮和面筋都很有韧劲，好吃。羊排香糯无比，蘸着配的辣油超级赞，一块吃下去很满足。朋友点的羊腰我没尝味道，但听他们直呼好吃。番茄牛肉味道很浓郁，甜甜的。牛肉酥烂，喜欢。烤杏鲍菇，第一次点，着实被惊艳到了，有点脆皮豆腐的感觉但是菇比较有嚼劲，香味回味无穷，推荐！薄饼羊肉卷也是第一次点但很失望，这个馅吃不到肉味感觉全是洋葱和甜椒，不喜欢。娜帕里勇，这个是朋友强烈推荐的，确实很好吃，奶香味十足不是很甜，千层糕的感觉。新疆黑啤冰的好爽，口感浓郁但不是很苦，好喝。服务员的态度很好，也很亲切，会继续光顾。,非常好
东西好吃价格还可以很不错.下次再来,非常好
自从去了一趟西疆！对西疆菜就情有独钟！时不时总要去吃西疆菜，耶里夏丽是我经常光顾的店，新疆大盘鸡超级大盘超推荐??！羊肉串自然也是相当赞??！关键羊肉串很便宜！晚上还有表演额！可惜我每次都没有机会看见，哈密瓜拔丝这个我不推荐，中看不中吃，服务员也是属于比较热情的！可惜不是新疆人！老板！请几个新疆服务员过来可好？,非常好
很爱吃羊腿，上海吃烤羊腿的地方，耶里夏丽我很中意，量足，因为生意好，肉也很新鲜，喜欢。,非常好
新疆菜我也是挺喜欢的，可惜现在要控制了，蛋白质太多,非常好
下午五点三刻去的，没排队，环境有点吵，有小朋友在舞台上玩耍打闹。,非常好
这个是我在周围看到比较好的店，档次不高，但是很用心去做。,非常好
总体真的还不错，有歌舞助兴，值得一去。,非常好
经常来，服务员盖爽服务态度很好，开心,非常好
新疆菜里还是耶里夏利的水平最稳定，烤羊排一如既往的好吃。雪域牛肉有点塞牙，火焰山的羊肉串比较好吃。歌舞表演也是吸引大家的一个卖点，东方路店可能老外比较多，演出前还讲了一堆英文介绍。貌似每家店的舞蹈风格有些不同，之前在正大店想在看Stripper…,非常好
地道好吃的新疆菜！奶酪，奶茶，羊排都让人喜欢??,非常好
吃得好饱，羊肉串必点，好多菜都有土豆，完全吃不下了，胃不够大！,非常好
还不错的！经常去吃！最近有些新的菜式！也保留了新疆传统菜式！口味比之前有一段时间要好很多！,非常好
常去的一家店，必点羊腿，奶茶，不过今天尝试了拔丝哈密瓜??，我的天，真的不好吃，像油豆腐包哈密瓜，甜品叫了娜帕里勇，真的很好吃。,非常好
总体来说还不错吃过两次感觉第二次没第一次好吃,非常好
今天魔都中午放大招一下子爆冷跑到浦东找小伙伴搓一顿想来还是耶里夏利吃点牛羊肉吧羊排每次必点依旧物美价廉因为羊排就五块两人怎么分呢嘿嘿用羊肉串补手抓羊肉饭也很好吃以前吃过所以这次必不可少还有一个煮牛肉名字忘记了也不错椒麻鸡不是很符合我的口味下次88了,非常好
喜欢吃，会考虑回头，菜品物美价廉,非常好
生意很好的一家店，做牛羊肉很擅长，鱼虾之类就不苟同了。表演不错，定期有新的歌舞演员，也算让人耳目一新了。,非常好
非常不错的一家店，晚上好像是7.30分有表演，可是去的时候没有表演，心里好失落+_+，不过菜品的味道绝对没得挑，羊排蘸着酱料，吃得满嘴油，烤鱼有点土腥味，但能证明是现杀现烤。虾的各头虽然小，但味道非常棒。,非常好
工作日的晚上到的比较早，不用等位子就是成功觅食的第一步呀！！首先地理位置更好，周边公交地铁都方便，而且店面也不小，中间搭设了舞台，吃饭的时候有新疆美女帅哥翩翩起舞，音乐是很欢快的新疆特色风格，让我们一边吃一边手舞足蹈，很是开心呀！,非常好
第二次吃的这家，羊肉串味道很赞！,非常好
烤羊肉串，个人不吃辣。所以要特别吩咐不要辣。外带的羊肉串，店家会将锡箔纸裹上以后再套上纸袋。特别用心也卫生。,非常好
好吃，远超期望值，请原谅我对新疆菜的偏见。支持，下次还会过来,非常好
看了三场演出，儿子好开心，黄礼花态度很好，服务棒,非常好
菜品不错，避免高峰等位，特意选择午市，服务员黄礼花人特别nice，吃完还帮我们打包，感觉不错的一次聚餐,非常好
五星吧。三个人点了五个菜，吃的挺满足。特色菜很棒，番茄牛肉炒粉丝什么的就比较一般啦...为了找过来吃，停车费了好久劲儿，吃货的力量。,非常好
味道很好，服务员黄礼花态度也不错??,非常好
非常好的餐厅，很有气氛，菜品也好，服务员不停来关照茶水，辅碟更换。谢谢美女服务员黄礼花！,非常好
比上次来印象改变太多了。就在家附近，第一次来印象不好，很久都没再来。这次随机挑了这家吃饭，改观很多。以后会经常来了。非常火的菜就不特别说了，味道都很赞！牛奶饭只要不是太怕甜的一定要点一份尝尝啊。绝对好吃,非常好
黄礼花，服务态度良好，餐厅环境好，口味不错,非常好
nice还有节目菜确实还可以新疆菜首选,非常好
耶里夏丽可以算作是一家百吃不厌的家常菜馆哈哈。,非常好
工作日午市吃的，8个人满满一桌菜，舒心,非常好
离家很近的一家店。去了N次。因上次表演真蛇??，吓得我再没有去过了。玩归玩，还是要考虑下每个顾客的心理。女孩子一般胆子小。不能这样吓的。而且影响胃口。点了一桌菜。完全没有胃口吃。害得一个星期吃不下饭。或者每次表演节目提前讲。,非常好
前几年因着某件事来这家店吃饭，当时场景太过狗血，事后完全不记得吃的如何但狗血的印象太过鲜明导致几年里都没想着再踏足这家店。（非店里的问题）,非常好
第二次来他家，原来中午也有表演的。整体依旧感觉不错，口味没啥变化，羊排我觉得不沾自带蘸料没啥味道，偏偏我不吃辣，蘸料还是辣味的……丁丁炒面还是那个味道，只是服务员人手不够，我们要个打包盒等了好久，并且只能自己打包，,非常好
实习的时候去吃的新疆菜非常棒，就是环境有点吵，晚上大厅有表演。于一六年九月,非常好
非常好吃！羊腿超级嫩！口味很赞，很地道！值得推荐！,非常好
羊肉抓饭内容丰富，上菜也快，值得再吃一次。恰玛古炒牛肉也还可以，就是上菜慢了。,非常好
有很多菜可以推荐的。手抓饭，羊排，牛肉。特别是手抓饭料很足。饮料也好喝。服务很好，快，到位。,非常好
全五星是结合性价比得出的结论。就连锁店而言，这家的羊牛肉品质真的不错，价廉物美份量大，特别适合肉食者。人少还真的不太好点，今天伙同一群人去吃中饭，点菜点过瘾了，还给他们安利了杏鲍菇，烤鱼??今天演出是第一次听到英文报幕，过了个年洋气了哟。,非常好
吃过一次。蛮惊艳的。肉食者的佳处。,非常好
菜做的挺好的，就是有点咸，黄礼花黄小姐的服务很到位，很感谢,非常好
春节的时候去的，现在补回点评，服务人员态度好的让我怀疑这家是不是黑店。呵呵，开玩笑啦。,非常好
从浦东公证处过来的，很近，公交车两站路，旁边有奶茶店，饰品店，宾馆什么的很方便，大概五分钟的路程有一个6号线浦电路地铁站，交通非常便利。,非常好
羊排味道不错，肉很嫩，但是拿出来是温的，加热程度不够，这是厨师的失误。羊杂汤很鲜。,非常好
冲着中午有舞蹈表演去的！停车券可以换一份酸奶。菜量超级大的，大盘鸡一盘就基本塞饱肚子了！超级好吃的羊排，基本每桌必点！有机会还想好好再享受一顿！可惜忘记拍照了！,非常好
一如既往的喜欢冰草非常好每次必点还有羊肉串也是最爱很喜欢的新疆菜馆品质如一,非常好
趁着冬天还在，又来吃羊肉了！没错，就是奔着羊肉来的！,非常好
店内充满浓郁的异域风情，标志性的伊斯兰教装修风格映入眼帘，颜色艳丽跳跃，仿佛真的来到了梦寐以求的新疆。,非常好
"离地铁站很近，就在东方路上，很好找到，生意真的很好，经常要排队的，正宗的新疆菜馆，非常异域的装修风格加上特色歌舞表演。电话预定只能预定晚上5:30之前的，舞蹈表演一般6:30开始一直跳到8点，中场会休息。大盘鸡的大盘子，真是超级大，盘子好大、面条顺滑的、土豆苏苏的,鸡肉很入味、。烤羊腿是必点的，肉质鲜嫩，肥肉很少，烤的恰到好处，份量也好多，很软很香，可以几个人吃。羊肉串有时是之前就烤好的，比较温，不过3.5一串的价格实在太便宜了，也没什么可抱怨的了。手抓饭里除了肉还加了新疆葡萄干，口感清淡吃到葡萄干就微微甜适合上海人的口味，咸里有点甜。拔丝哈密瓜的外皮很甜，浆挂得也有点厚，里面的瓜变得没一丝甜味了，也可能瓜本身就不是很甜，用外面来增加甜味。",非常好
不爱吃羊肉之类的我去过耶丽夏丽也爱上了新疆菜浓浓的奶味量很足晚上还有表演互动过节气氛很好经常有会跳舞的顾客上台一起跳舞很愉快的用餐推荐大盘鸡本人不爱吃鸡但是大盘鸡我很爱吃没有鸡的怪味道羊肉串也特别香牛奶饭奶味十足,非常好
新疆菜的龙头了，服务很热情，东西很好吃,非常好
小年夜去吃的最后顿工作日午饭，还看到了新疆妹子的表演，菜也好吃的，价格也实惠,非常好
地道的新疆餐馆各色羊肉。部门聚会选择这里人多吃的品种多羊肉串是最爱性价比超高！羊排羊腿的羊肉都很嫩大口吃肉的感觉特别过瘾。丁丁炒面很入味面条筋道有嚼劲推荐。凉皮深受女生喜欢必点！乳酪的糕点叫什么没记住口感舒服不是很甜也不腻推荐尝试一下。,非常好
表演不错，羊肉串赞，大盘鸡一般般,非常好
羊排羊排羊排，超好吃??,非常好
每次去都是生意爆好的一家店，虽然门面不起眼，但是回头客特别多。很早就订了一个包厢是公司聚餐用的，位置还是很好的，正好对着舞台。刚刚开始就餐第一场歌舞就开始了。羊肉串还是很喜欢的，比起羊腿更喜欢。牛肉也不错，蛮嫩的。冷盘的量不算多，都点了两份。热菜的量还是可以的。总体来说，吃的还是很好的，价格也不贵。,非常好
很早之前去吃的了~~,非常好
想吃新疆菜，第一个想到了耶里夏丽。,非常好
菜依然可口。特别是黄礼花服务员的服务贴心，有小朋友调皮也是一直微笑服务，赞！,非常好
很满意。去吃的那天是我生日，然后就坐等菜的时候除了有美女跳舞，还居然放了两次生日快乐歌，蛮巧合的。,非常好
和同学一起逛完浦建路的花鸟市场逛完决定到耶里夏丽吃午饭主要突然想吃新疆菜了家门口的新疆菜永远没有耶里夏丽的好吃不知道为什么吃了很多家新疆菜还是这家老牌的味道最好大盘鸡里的鸡和土豆味道都很入味了最后还把汤汁都打包回家了哈哈羊肉卷好吃不油不腻包着皮很好吃那个烤杏鲍菇很惊艳酥脆酥脆的不愧是老牌新疆菜真是好吃,非常好
?匆匆而来匆匆而往不要忘记感受身边的美好,非常好
很喜欢的店，肉都很赞，有表演气氛很好,非常好
本人最爱的新疆菜餐厅，没有之一,非常好
年前带孩子和妈妈去吃了，我妈喜欢上了新疆菜，我女儿被美美的表演吸引到了，菜量十足，就是吃不了辣的人有待考虑！,非常好
耶里夏利是我们每个月必来的餐厅，主要事女儿特别喜欢这里的舞蹈表演，三岁的女儿每次来必上台跳舞。而我和老公最喜欢这里的羊肉串和薄饼卷羊肉。电话预定座位只能预定晚上5:30之前的位置，舞蹈表演晚上6:30开始一直跳到8点，中场会休息。,非常好
不错哦，是我吃过新疆菜西北菜中最好吃的一家了，最符合上海口味，羊肉串也是最好吃的，没有骚味。没想到的是最骚的是奶茶，特别是咸味的。大盘鸡味道也不错，但有点老。娜帕里用味道一般，可能甜点吃多了有些腻了。牛奶饭不错哦，没有违和感。风味炒馕一般，酸奶一般。总体口味还是不错的。价格也一般。,非常好
菜品地道好吃，环境温馨安，非常适合用餐，高个子美女服务非常好，关键还长得忒漂亮大赞,非常好
好吃。，还有舞蹈表演，上菜也很快,非常好
张露露的服务真心好的没话说，满分好评,非常好
全五星！很爽快！对于挑剔的我来说比较少见了。店面大小合适，装修风格比较西域，有表演场地。坐在舞台旁边的桌，很有感觉。菜上的很快，大口吃肉一下就饱了，所以建议吃一两个菜再点其它的。再说说肉，巴适地道！羊排羊腿大盘鸡羊肉串都得吃啊。。。最后发现还不算贵，值了！,非常好
新年朋友聚会选在了这儿，大堂都是小桌，自然选择了包间。菜上的很快，最惊艳我的是大盘鸡的大盘子，真是超级大。,非常好
哎哟我的妈！我吃过的最好吃的新疆餐厅了！,非常好
上海开了这么多年，第一次来吃呢，过年的最后一天，节日气氛依然很浓烈，有歌舞表演，不过时间很短，整个空气中弥漫着淡淡的羊肉味，凭停车票会送一份酸奶哦，一家三口点了大盘鸡69元，量很大的，里面有鸡肉，土豆和面皮，两个人吃不完，微辣的。羊排69例份，有5根，这个最好吃，羊肉超级嫩，入口即化的感觉，蘸料也很像。牛奶饭19，给宝宝点的，有点双皮奶的感觉。特色奶茶39一壶，装在像阿拉丁神灯一样的壶里，口味有甜，咸和原味可以选择，我们选的原味很好喝。羊肉串3.5一串，也蛮好吃的。还有个椒盐烤杏鲍菇19，不像烤出来的，像炸出来的，有点油，味道也不错！一顿饭买单200多吃了撑死了。,非常好
味道不错哦。人有点多。还有歌舞表演,非常好
上海啥店都很火爆！！！小伙伴提前占座才行。场地很大，座位很挤。菜品味道不错，份量也还可以。新疆风味的，酸奶，羊肉都很好吃。中间有个类似T台，大概8点左右还有表演，几个姑娘小伙上去跳舞。人太多，上菜有点慢。,非常好
有演出，环境很好，很好吃～好多肉～,非常好
跟老公来上海玩，没想到第一餐吃的是这家新疆菜！本来还没抱着太大希望，结果一吃惊艳啊！真的每个菜都超好吃！还吃了很多一般新疆菜馆没有的菜品！推荐烤羊排和牛奶饭，超好吃！还有自制酸奶！那个耶里夏丽人饮料倒是很一般，不怎么惊艳，长得像哈密瓜汁，口感像猕猴桃！,非常好
羊排按伪氐悖一根可以啃很久的骨头,非常好
耶里夏丽是一家性价比很高的新疆餐厅，特别是他家的烤羊腿，外酥里嫩，鲜嫩多汁，让人欲罢不能。他家还有一个甜点叫做拿破里勇，是用奶酪做的，儿子特别喜欢吃。还有自制酸奶也是一绝，特别的香浓。总之就是我们全家经常光顾的一家餐厅。,非常好
真的很不错，并且还有美女跳舞??，赞,非常好
论服务，要属这家最可爱最热情，宛如朋友般的推荐。,非常好
年底同事聚会，整个环境特别热闹，特地订了大堂可以看表演。有酒喝，有肉吃，有舞看～太适合聚会了～菜量很大，我们都属于眼睛大胃口小的一类，羊肉特别正宗，基本上吃一半剩一半了，所以以后点菜的时候要注意了，要适量～,非常好
份量足，气氛好，朋友聚餐真的很开心，甜点都好吃,非常好
应该是全上海最好的一家耶里夏丽的，味道也很好，就是离的远了点,非常好
朋友聚会，晚到了，都吃了一点了。羊肉呢，蛮香的，羊排太容易饱了，敦实。牛奶饭好吃的，可惜太腻，容易饱，鱼肉太少，但是烤的很香。最喜欢这个虾，做的不错，甜甜的，好吃。来碗酸奶开开胃。新疆菜就是太容易吃饱了，唯一不好的估计就是鸡翅了，以为是烤的，最后来的是奥尔良的。有点失落呀。服务还真的是蛮好的，全程不停的帮你换骨盘。吃饭期间还一直有人跳舞。总体觉得很好。,非常好
菜品味道很不错，羊肉串确实好吃??,非常好
和朋友来这里吃饭，大家一起很开心。,非常好
第一次来耶里夏丽，挺正宗的。特别喜欢吃牛奶饭跟手抓饭。还有就是必点の酸奶，感觉不够甜，问了服务员说已经加了蜂蜜，还是不甜。其次是孜然基围虾，好大一个虾，吃起来脆脆の。还有就是羊肉脆饼，脆饼稍微有点硬，里面的羊肉味道还可以，就是单吃有点咸。,非常好
羊肉串好吃哭了啊啊啊，比某羊天下好太多，一点也不骚哈哈~馕也好吃！,非常好
很棒的一家新疆菜馆，量超大，特别是大盘鸡太实惠了,非常好
这几天吃的外卖里面最好吃的一家,非常好
好像味道没以前好了，今天正好小朋友生日，感觉有点小失望。大盘鸡说没有我做的好吃。哇嘎嘎！,非常好
超好吃的每次出差必吃！手抓羊肉棒棒的,非常好
